{
  "$schema": "https://json-schema.org/draft/2020-12/schema",
  "$id": "https://kodeme.io/contracts/ebooks/ebook.v1.schema.json",
  "title": "Ebook v1",
  "description": "An e-book (e-book factory, F4/EBK1 spec D2): one committed book per directory under ebooks/<id>/ -- ebook.yaml (this document) plus book.md, the book's canonical MARKDOWN SOURCE, which is the single source both renderers consume. Markdown is derived from the chapters below and the derivation is pinned byte-for-byte in both repos (kodemeio-dokploy deploys/tests/test_contracts_ebooks.py and the consumer's factory_ebook), so the prose a human reads in book.md and the data the factory renders from ebook.yaml can never drift apart. The block vocabulary is F3's (template.v1), shared BY REFERENCE as a pinned copy: heading, paragraph, list, table, image, spacer, footer, disclaimer -- a DRIFT test pins the eight branches to the template contract, and an unknown block matches no branch and is refused. The cover is a TYPED BLOCK SET, never free-form HTML: the book's own title/subtitle/author/locale metadata plus this document's `cover.logo` (an `asset:<key>` reference, because the licence lives with the asset and never with the document) and `cover.palette` (a KIT colour role name, never a hex value -- the brand kit supplies the colour). Two renderers are named as data, one per format: pdf -> typst, epub -> pandoc; a renderer the consumer does not have REFUSES by name (\"typst not installed\" / \"pandoc not installed\") and there is no fallback. The human label is `title`, not `name`: `name` is refused by the shared PII property-name denylist (deploys/tests/contracts_lib.py PII_NAMES), which every schema in this repo is checked against. The schema is deliberately SELF-CONTAINED (no $ref, not even to its own branches) so contracts_lib's schema walkers keep working on it -- at the cost of the block branches being written once here and once in template.v1.",
  "type": "object",
  "additionalProperties": false,
  "required": [
    "id",
    "version",
    "title",
    "author",
    "locale",
    "page",
    "cover",
    "chapters",
    "variables",
    "assets",
    "outputs",
    "renderers",
    "brand"
  ],
  "properties": {
    "id": {
      "type": "string",
      "pattern": "^[a-z][a-z0-9-]{1,63}$",
      "description": "Kebab slug; also the directory name under ebooks/ and the import key."
    },
    "version": {
      "type": "integer",
      "minimum": 1,
      "description": "Monotonic per id: a consumer refuses a lower or equal version (drift refusal)."
    },
    "title": {
      "type": "string",
      "minLength": 1,
      "description": "The book's title -- the H1 of the Markdown source and the cover's headline. Deliberately not `name` (see the schema description)."
    },
    "subtitle": {
      "type": "string",
      "minLength": 1,
      "description": "Printed under the title on the cover and in the Markdown front matter. Optional."
    },
    "author": {
      "type": "string",
      "minLength": 1,
      "description": "The name printed on the cover. A pen name for a house imprint, never a customer: this is catalogue metadata, not personal data about a reader."
    },
    "locale": {
      "type": "string",
      "pattern": "^[a-z]{2}_[A-Z]{2}$",
      "description": "The book's language, and the default render locale (`{{option.locale}}` overrides it per variant)."
    },
    "page": {
      "type": "object",
      "additionalProperties": false,
      "required": [
        "size",
        "orientation",
        "margins"
      ],
      "properties": {
        "size": {
          "enum": [
            "A4",
            "A5",
            "Letter"
          ]
        },
        "orientation": {
          "enum": [
            "portrait",
            "landscape"
          ]
        },
        "margins": {
          "type": "object",
          "additionalProperties": false,
          "required": [
            "top",
            "right",
            "bottom",
            "left"
          ],
          "properties": {
            "top": {
              "type": "number",
              "minimum": 0,
              "maximum": 60
            },
            "right": {
              "type": "number",
              "minimum": 0,
              "maximum": 60
            },
            "bottom": {
              "type": "number",
              "minimum": 0,
              "maximum": 60
            },
            "left": {
              "type": "number",
              "minimum": 0,
              "maximum": 60
            }
          }
        }
      },
      "description": "The page box of the PDF rendering, in millimetres. Kept for the EPUB book too (a reflowable book has no page box; the field is recorded, not a claim about the EPUB)."
    },
    "cover": {
      "type": "object",
      "additionalProperties": false,
      "required": [
        "logo"
      ],
      "properties": {
        "logo": {
          "type": "string",
          "pattern": "^asset:[a-z0-9-]+$",
          "description": "The cover's logo, as a key into the consumer's licence-checked asset library. Never a URL: the licence lives with the asset, and the renderer places a LABELLED PLACEHOLDER for it rather than fetching bytes (spec section 4)."
        },
        "palette": {
          "enum": [
            "primary",
            "accent",
            "muted",
            "card"
          ],
          "description": "The BRAND KIT colour role the cover band is painted with -- a name, never a hex value, so the kit stays the single source of the look. Defaults to `primary`."
        }
      },
      "description": "The cover as a TYPED BLOCK SET (spec D3), never free-form HTML: the cover page is built by the renderers from this book's title/subtitle/author metadata plus `logo` and `palette`."
    },
    "chapters": {
      "type": "array",
      "minItems": 1,
      "items": {
        "type": "object",
        "additionalProperties": false,
        "required": [
          "id",
          "title",
          "blocks"
        ],
        "properties": {
          "id": {
            "type": "string",
            "pattern": "^[a-z][a-z0-9-]{1,63}$",
            "description": "The chapter's stable key (kebab slug), used by the factory's diagnostics and by any future per-chapter routing."
          },
          "title": {
            "type": "string",
            "minLength": 1,
            "description": "The chapter's heading in the Markdown source (an `##`), and its entry in the table of contents."
          },
          "blocks": {
            "type": "array",
            "minItems": 1,
            "description": "The chapter's content, in order, from the shared closed block vocabulary. Never free-form HTML.",
            "items": {
              "description": "A block. An unknown `type` matches no branch and is refused.",
              "oneOf": [
                {
                  "type": "object",
                  "additionalProperties": false,
                  "required": [
                    "type",
                    "text"
                  ],
                  "properties": {
                    "type": {
                      "const": "heading"
                    },
                    "text": {
                      "type": "string",
                      "minLength": 1
                    },
                    "level": {
                      "enum": [
                        1,
                        2,
                        3
                      ]
                    }
                  }
                },
                {
                  "type": "object",
                  "additionalProperties": false,
                  "required": [
                    "type",
                    "text"
                  ],
                  "properties": {
                    "type": {
                      "const": "paragraph"
                    },
                    "text": {
                      "type": "string",
                      "minLength": 1
                    }
                  }
                },
                {
                  "type": "object",
                  "additionalProperties": false,
                  "required": [
                    "type",
                    "items"
                  ],
                  "properties": {
                    "type": {
                      "const": "list"
                    },
                    "items": {
                      "type": "array",
                      "minItems": 1,
                      "items": {
                        "type": "string",
                        "minLength": 1
                      }
                    },
                    "ordered": {
                      "type": "boolean"
                    }
                  }
                },
                {
                  "type": "object",
                  "additionalProperties": false,
                  "required": [
                    "type",
                    "columns"
                  ],
                  "properties": {
                    "type": {
                      "const": "table"
                    },
                    "columns": {
                      "type": "array",
                      "minItems": 1,
                      "items": {
                        "type": "string",
                        "minLength": 1
                      }
                    },
                    "rows": {
                      "type": "array",
                      "items": {
                        "type": "array",
                        "items": {
                          "type": "string"
                        }
                      }
                    }
                  }
                },
                {
                  "type": "object",
                  "additionalProperties": false,
                  "required": [
                    "type",
                    "asset"
                  ],
                  "properties": {
                    "type": {
                      "const": "image"
                    },
                    "asset": {
                      "type": "string",
                      "pattern": "^asset:[a-z0-9-]+$",
                      "description": "A key into the consumer's licence-checked asset library. Never a URL."
                    },
                    "alt": {
                      "type": "string",
                      "minLength": 1
                    }
                  }
                },
                {
                  "type": "object",
                  "additionalProperties": false,
                  "required": [
                    "type"
                  ],
                  "properties": {
                    "type": {
                      "const": "spacer"
                    },
                    "size": {
                      "enum": [
                        "small",
                        "medium",
                        "large"
                      ]
                    }
                  }
                },
                {
                  "type": "object",
                  "additionalProperties": false,
                  "required": [
                    "type",
                    "text"
                  ],
                  "properties": {
                    "type": {
                      "const": "footer"
                    },
                    "text": {
                      "type": "string",
                      "minLength": 1
                    }
                  }
                },
                {
                  "type": "object",
                  "additionalProperties": false,
                  "required": [
                    "type",
                    "text"
                  ],
                  "properties": {
                    "type": {
                      "const": "disclaimer"
                    },
                    "text": {
                      "type": "string",
                      "minLength": 1
                    }
                  }
                }
              ]
            }
          }
        }
      },
      "description": "The chapter tree: an ordered list of chapters, each a title and a block flow. At least one chapter must place a `disclaimer` block -- the kit's mandatory text is checked against the RENDERED book, and the structural half (a disclaimer block exists at all) is refused by the consumer otherwise."
    },
    "variables": {
      "type": "array",
      "items": {
        "type": "object",
        "additionalProperties": false,
        "required": [
          "key",
          "type"
        ],
        "properties": {
          "key": {
            "type": "string",
            "pattern": "^[a-z][a-z0-9_]{1,31}$",
            "description": "Referenced from a block as {{var.<key>}}. A key starting with `child_` is refused by the shared PII denylist, on purpose: a book declares what it prints, never who reads it."
          },
          "type": {
            "enum": [
              "string",
              "int",
              "date",
              "enum"
            ]
          },
          "required": {
            "type": "boolean",
            "description": "A required variable with no value refuses the render, naming it."
          },
          "default": {
            "description": "Used when no value is supplied. Must satisfy `type` (and `enum`)."
          },
          "enum": {
            "type": "array",
            "minItems": 1,
            "items": {
              "type": "string"
            },
            "description": "The allowed values, for `type: enum`."
          },
          "description": {
            "type": "string"
          }
        },
        "allOf": [
          {
            "if": {
              "required": [
                "type"
              ],
              "properties": {
                "type": {
                  "const": "enum"
                }
              }
            },
            "then": {
              "required": [
                "enum"
              ]
            }
          }
        ],
        "description": "A typed input. A value matching a PII pattern refuses the render's checks; a value for an undeclared key refuses the import."
      }
    },
    "assets": {
      "type": "object",
      "additionalProperties": false,
      "required": [
        "fonts"
      ],
      "properties": {
        "fonts": {
          "type": "object",
          "minProperties": 1,
          "additionalProperties": {
            "type": "string",
            "pattern": "^asset:[a-z0-9-]+$",
            "description": "A key into the consumer's licence-checked asset library. Never a URL."
          },
          "required": [
            "heading",
            "body"
          ],
          "properties": {
            "heading": {
              "type": "string",
              "pattern": "^asset:[a-z0-9-]+$",
              "description": "A key into the consumer's licence-checked asset library. Never a URL."
            },
            "body": {
              "type": "string",
              "pattern": "^asset:[a-z0-9-]+$",
              "description": "A key into the consumer's licence-checked asset library. Never a URL."
            }
          },
          "description": "Font roles (at least heading and body) -> `asset:<key>` of a usable font asset. A font may appear in this bucket and nowhere else."
        },
        "images": {
          "type": "object",
          "additionalProperties": {
            "type": "string",
            "pattern": "^asset:[a-z0-9-]+$",
            "description": "A key into the consumer's licence-checked asset library. Never a URL."
          },
          "description": "Image roles -> `asset:<key>` of a usable image asset. The cover's logo and every image block must appear here."
        }
      },
      "description": "role -> licensed asset key. `fonts` is the only bucket a font may appear in; `images` is the only bucket an image may appear in."
    },
    "outputs": {
      "type": "array",
      "minItems": 1,
      "items": {
        "enum": [
          "pdf",
          "epub"
        ]
      },
      "contains": {
        "const": "pdf"
      },
      "description": "The formats this book ships. `pdf` is required (it is the expert-reviewed artifact); `epub` is the blueprint's second format and its absence must be an explicit, recorded choice on the work order -- the release predicate refuses a silent single-format release (spec D2/A5)."
    },
    "renderers": {
      "type": "object",
      "additionalProperties": false,
      "required": [
        "pdf"
      ],
      "properties": {
        "pdf": {
          "const": "typst",
          "description": "PDF through the Typst route. A consumer without the `typst` package REFUSES with the named error `typst not installed` -- never a fallback, never a partial document."
        },
        "epub": {
          "const": "pandoc",
          "description": "EPUB through Pandoc, from the same Markdown source. A consumer without the `pandoc` binary REFUSES with the named error `pandoc not installed`."
        }
      },
      "description": "format -> renderer. Two renderers, one per format, both honest about absence (spec D2)."
    },
    "brand": {
      "type": "object",
      "additionalProperties": false,
      "required": [
        "kits"
      ],
      "properties": {
        "kits": {
          "type": "array",
          "minItems": 1,
          "items": {
            "type": "string",
            "pattern": "^[a-z][a-z0-9-]{1,31}$"
          },
          "description": "Brand kit codes this book is approved to render under. The kit supplies the palette, the fonts and the mandatory disclaimers, so one Markdown source renders many covers and themes, and a kit not listed here refuses the render by name."
        }
      }
    }
  },
  "allOf": [
    {
      "if": {
        "required": [
          "outputs"
        ],
        "properties": {
          "outputs": {
            "contains": {
              "const": "epub"
            }
          }
        }
      },
      "then": {
        "properties": {
          "renderers": {
            "required": [
              "epub"
            ],
            "description": "A book that ships an EPUB names its EPUB renderer."
          }
        }
      }
    }
  ]
}
